,title,text,link,label
0,Krieg im Donbass: Ukraine verkündet das Ende des Abkommens von Minsk – Anti-Spiegel,"Präsident Selensky hat de facto das Ende des Abkommens von Minsk verkündet mitteilen lassen, seine Vorschläge an Deutschland und Frankreich geschickt zu haben. Wenn die zustimmen, dürfte das Minsker Abkommen Geschichte sein.

Um zu verstehen, worum es hier geht, müssen wir uns kurz die Chronologie der Ereignisse anschauen. Nach dem Maidan-Putsch schickte Kiew im April 2014 Truppen anstatt Unterhändler in den Donbass und rief die sogenannte Anti-Terroroperation (ATO) aus. Das war der Beginn des Krieges im Donbass. Der erwartete schnelle Sieg blieb aus und im Februar 2015 haben Kiew und die Rebellen das Minsker Abkommen geschlossen, das durch Vermittlung von Deutschland, Frankreich und Russland zu Stande gekommen ist.

Weder Deutschland, noch Frankreich oder Russland sind dabei Vertragsparteien und keines der Länder ist in dem Abkommen erwähnt und an keines der Länder werden in dem Abkommen Forderungen gestellt. Dass die westlichen Medien und Politiker seit dem behaupten, Russland müsse das Abkommen erfüllen, bevor die Russland-Sanktionen gelockert werden können, ist an Absurdität kaum zu überbieten – wie soll man ein Abkommen erfüllen, das man nicht unterschrieben hat und in dem man nicht einmal erwähnt ist?

Das Minsker Abkommen

In dem Minsker Abkommen wird in 13 Punkten geregelt, wie es zu einem Frieden im Donbass kommen und wie Kiew die Kontrolle über die Gebiete wieder zurückerhalten kann. Die Details inklusive Text es Abkommens finden Sie hier.

Grob gesagt sieht das Abkommen folgende Schritte vor: Kiew sollte schon 2015 eine Verfassungsreform vornehmen, die den Gebieten im Osten des Landes einen Sonderstatus garantieren und mit den Rebellen direkt über Wahlen verhandeln, die Ende 2015 stattfinden sollten. Außerdem sollte vor den Wahlen eine Generalamnestie beschlossen werden. Danach sollte Kiew die Kontrolle über die Gebiete zurückerhalten.

Kiew lehnt direkte Gespräche mit den Rebellen bis heute ab, obwohl es sich in dem Abkommen dazu verpflichtet hat. Auch die Verfassungsreform ist nie beschlossen worden und von einer Generalamnestie will Kiew erst recht nichts wissen.

Die Rebellen werden aber die Waffen nicht niederlegen, wenn sie befürchten müssen, anschließend verfolgt und verhaftet zu werden. Die festgelegte Reihenfolge der Schritte macht also Sinn, wenn man eine Versöhnung und einen Frieden erreichen möchte. Eine andere Reihenfolge ist nicht denkbar. Wenn die Rebellen befürchten müssen, verfolgt und verhaftet zu werden, hört der Krieg nicht auf. Die Alternative wäre eine militärische Lösung mit tausenden Toten und Straßenkämpfen in den ostukrainischen Großstädten, in denen immer noch hunderttausende Zivilisten leben.

Kiew will das Abkommen nicht umsetzen

Schon nach dem letzten Treffen im Normandie-Format zwischen Merkel, Macron, Selensky und Putin im Dezember 2019 in Paris machte Selensky deutlich, dass Kiew das Abkommen am liebsten annullieren möchte. Kiew fordert nun, dass Kiew zuerst die Kontrolle über die Gebiete bekommen soll und dass erst danach Wahlen stattfinden sollten. Von einer Generalamnestie und der Verfassungsreform wird in Kiew nicht mehr ernsthaft gesprochen. Wozu auch? Kiew hat all diese (und noch einige weitere) in dem Abkommen übernommene Verpflichtungen in den letzten sechs Jahren nicht umgesetzt und ist damit durchgekommen. Kritik aus dem Westen gab es nicht.

Seit dem Amtsantritt von US-Präsident Biden spürt Kiew Rückenwind. Selensky geht rücksichtslos gegen Opposition und kritische Medien und vor und die Rhetorik wird militaristischer. In Kiew ist von einem „Plan B“ für den Donbass die Rede und der Beschuss durch die ukrainische Armee verstärkt sich wieder. Der seit letztem Sommer einigermaßen eingehaltene Waffenstillstand gerät zunehmend in Gefahr. In Russland befürchtet man, dass eine ukrainische Offensive für Mai geplant ist, wenn die vom Winter verschlammten Schlachtfelder getrocknet sind.

Selensky lässt Ende des Minsker Abkommens verkünden

Jetzt hat Andrej Ermak, der Chef der ukrainischen Präsidialverwaltung, de facto das Ende des Minsker Abkommens verkündet. Ukrainische Medien zitieren ihn wie folgt:

„Heute liegt ein konkreter Plan für eine friedliche Regelung auf dem Tisch, der von Deutschland und Frankreich vorgeschlagen und von der Ukraine fertiggestellt wurde, die, wie wir glauben, dem Geist von Minsk in Übereinstimmung mit den Normen des Völkerrechts entspricht.“

Ob Kiew immer die Wahrheit sagt, ist bekanntlich zweifelhaft. Aber aus Frankreich und Deutschland sind bisher keine Dementis gekommen. Wenn es aber stimmt, dass Frankreich und Deutschland einen neuen „Friedensplan“ vorgeschlagen haben, anstatt am Abkommen von Minsk festzuhalten, muss das gut versteckt hinter den Kulissen geschehen sein, denn Meldungen darüber gab es bisher keine.

Aufhorchen lässt die Formulierung, Kiew habe den Vorschlag „fertiggestellt„, denn das würde bedeuten, dass es sich um ein Diktat oder Ultimatum an die Rebellen handeln muss, frei nach dem Motto „friss oder stirb“ – wobei in diesem Falle „stirb“ wörtlich zu nehmen ist, immerhin reden wir von einem Krieg.

Weiter wird Ermak wie folgt zitiert:

„Wenn Russland nicht zustimmt, bedeutet das ihm zufolge, „dass es kein Ende des Krieges und der Offensive des Friedens im Donbass will.““

Sollte es diesen von Deutschland und Frankreich vorgeschlagenen und Kiew „fertiggestellten“ Plan tatsächlich geben, dürften wir genau diese Formulierungen demnächst in den Medien lesen: „Russland will keinen Frieden im Donbass, darum flammt der Krieg neu auf!“

Gibt es den Plan tatsächlich?

Die Frage ist, ob Kiew die Wahrheit sagt und es den Plan tatsächlich gibt. Deutschland und Frankreich schweigen bisher dazu, in Russland scheint man von all dem auch nichts zu wissen. Ukrainische Medien berichten außerdem:

„Der Vertreter der Ukraine bei den Konsultationen im Normandie-Format auf der Ebene der politischen Berater erklärte, dies sei ein „sehr mächtiger Schritt“, den Deutschland und Frankreich vorgeschlagen hätten. Ermak hofft, dass er während der Videokonferenz im Normandie-Format „in ein oder zwei Wochen Gegenstand einer starken Diskussion“ sein wird.“

Wir werden also bald erfahren, ob es den Plan tatsächlich gibt und ob Deutschland und Frankreich ihn unterstützen und was in dem Plan überhaupt drin steht. Aber ukrainische Vertreter sprechen in den letzten Tagen immer öfter von „mächtigen“ oder „radikalen“ Schritten in Sachen Donbass.

Wenden sich Deutschland und Frankreich vom Minsker Abkommen ab?

Es ist zu befürchten, dass Deutschland und Frankreich tatsächlich der Linie Kiews folgen und sich vom Minsker Abkommen verabschieden. Mitte Februar hat Russland bei der OSZE routinemäßig eine Initiative eingebracht, die erneut zur Umsetzung des Abkommens von Minsk aufrufen sollte. Die Initiative enthielt drei Punkte: Unterstützung des vom UN-Sicherheitsrat gebilligten Minsker Abkommens, Aufforderung nach baldiger Umsetzung und eine Aufforderung an die OSZE, dabei behilflich zu sein. Man sollte meinen, dass es bei der OSZE keine Probleme bereiten sollte, einer solchen Initiative zuzustimmen, immerhin reden ja alle Staaten (bestenfalls mit Ausnahme der Ukraine) davon, dass es zum Abkommen von Minsk keine Alternative gebe und dass man an dem Abkommen festhält.

Aber es kam anders: Die Staaten des Westens – einschließlich Deutschlands und Frankreichs, die das Abkommen mit ausgehandelt haben – haben gegen die Initiative gestimmt. Und sogar Schweden, Vorsitzender der OSZE, die die Umsetzung des Abkommens überwachen soll, hat gegen die Initiative gestimmt.

Daher ist die Vermutung nicht von der Hand zu weisen, dass Deutschland und Frankreich sich von dem Abkommen abgewandt haben.

Wenn das stimmt, dürften wir im Frühjahr eine neue ukrainische Offensive im Donbass erleben und die westlichen Medien werden berichten, das Abkommen von Minsk wäre tot. Die Schuld an der Eskalation wird man natürlich Russland zuschieben.

Bin ich zu pessimistisch? Wir werden es im Mai wissen.

Wenn Sie sich für die Ukraine nach dem Maidan und für die Ereignisse des Jahres 2014 interessieren, als der Maidan stattfand, als die Krim zu Russland wechselte und als der Bürgerkrieg losgetreten wurde, sollten Sie sich die Beschreibung zu meinem Buch einmal ansehen, in dem ich diese Ereignisse detailliert auf ca. 670 Seiten genau beschreibe. In diesen Ereignissen liegt der Grund, warum wir heute wieder von einem neuen Kalten Krieg sprechen. Obwohl es um das Jahr 2014 geht, sind diese Ereignisse als Grund für die heutige politische Situation also hochaktuell, denn wer die heutige Situation verstehen will, muss ihre Ursachen kennen.

In meinem neuen Buch „„Putins Plan – Mit Europa und den USA endet die Welt nicht – Wie das westliche System gerade selbst zerstört ““ gehe ich der der Frage, worum es in dem Endkampf der Systeme - den wir gerade erleben - wirklich geht. Wir erleben nichts weniger als den Kampf zweier Systeme, in dem Vladimir Putin der Welt eine Alternative zum neoliberalen Globalismus anbietet. Wurden die Bürger im Westen gefragt, ob sie all das wollen, ob sie zu Gunsten des neoliberalen Globalismus auf ihren Wohlstand und ihre Freiheiten verzichten wollen?

Das Buch ist aktuell erschienen und ausschließlich hier direkt über den J.K. Fischer Verlag bestellbar.



Teile diesen Beitrag teilen

teilen

mitteilen

E-Mail

teilen",https://www.anti-spiegel.ru/2021/krieg-im-donbass-ukraine-verkuendet-das-ende-des-abkommens-von-minsk/,Maidan in 2014 was a coup d'état
1,Die Lebkuchenhexe aus Washington – Jetzt intrigiert sie gegen Nord Stream 2,"Die Lebkuchenhexe aus Washington – Jetzt intrigiert sie gegen Nord Stream 2

Da ist sie wieder, Victoria Nuland, die Keksverteilerin vom Maidan, und intrigiert gegen Nord Stream 2. Dabei geht es sie einen feuchten Kehricht an, womit wir in Deutschland unsere Wohnungen heizen. Leider fehlen uns Politiker, die ihr erklären, wovon sie ihre Finger lassen soll.

von Dagmar Henn

Das bekannteste Märchen in Deutschland ist das von Hänsel und Gretel. Von den Eltern ausgesetzt, irren sie durch den Wald und geraten an ein Haus, das aus Lebkuchen erbaut ist. Hungrig greifen sie danach und erschrecken, als eine Stimme aus dem Haus ertönt: ""Knusper, knusper knäuschen, wer knabbert an meinem Häuschen?"" Der weitere Verlauf der Geschichte ist bekannt, die Bewohnerin des Backwerkhauses ist eine böse Hexe, die Hänsel zum Mästen einsperrt, aber schließlich von Gretel in den Ofen geschubst wird.

Wenn die Lebkuchenhexe eine irdische Inkarnation hat, dann heißt sie Victoria Nuland. Jene US-Amerikanerin, die auf dem Maidan Kekse verteilte, um für einen blutigen Umsturz in der Ukraine zu sorgen; die die gewünschte Junta mit ""Fuck the EU"" aus US-Marionetten bastelte. Die fleischgewordene Bösartigkeit der US-Außenpolitik. Nach Jahren in der Versenkung unter Trump ist sie wieder nach oben geschwappt und geifert jetzt gegen Nord Stream 2. Und erklärt:

""Was wir tun, wir arbeiten jetzt mit den Deutschen, arbeiten mit der EU, um ihre Überlegungen zur Eröffnung der Pipeline zu verlangsamen. Diese deutsche Regierung hat bedeutende Schritte unternommen, das zu tun, und sie hat auch die Übereinkunft bestätigt, die wir mit der vorhergehenden Regierung hatten, was mit Nord Stream 2 geschehen soll – insbesondere, dass es gestoppt wird, wenn Russland gegen die Ukraine aggressiv wird.""

Nuland ist so ziemlich die letzte Person auf diesem Planeten, die über ""russische Aggressionen gegen die Ukraine"" reden sollte. Schließlich waren es die von ihr installierten Marionetten, die den Weg in Richtung Bürgerkrieg gebahnt haben. Und sie haben sich bestimmt täglich ihre frischen Instruktionen bei Frau Nuland abgeholt. Sie erweckt nicht den Eindruck, als gebe sie Dinge gern aus ihrer Kontrolle.

""Knusper, knusper, knäuschen, wer knabbert an meinem Häuschen?""

Da stehen wir also, wir armen Deutschen, hätten gerne eine warme Wohnung im Winter und Strom, der so verlässlich wie bezahlbar ist, und haben nicht nur die Grünen am Hals, die die CO2-Steuern noch weiter nach oben treiben wollen, statt sie wegen der hohen Preise zu streichen, wie im Nachbarland Frankreich. Nein, dahinter steht die Hexe vom Maidan und wartet darauf, uns im US-Interesse zu frosten.

Vor kurzem gab es zwar die Meldung, die US-Demokraten wollten etwas vorsichtiger mit Nord Stream 2 umgehen; aber bis zu Nuland scheint das nicht vorgedrungen zu sein. Oder sie ist ohnehin auf jedem Ohr taub, auf dem nicht gerade gegen Russland getrommelt wird. Allerdings sollte sie, als US-Politikerin, doch die US-Bürger für ihre geliebten Bandera-Fans frieren lassen. Ich jedenfalls will das nicht und kann mir vorstellen, dass ich damit nicht alleine dastehe.

Aber schon, dass sie eine solche Dreistigkeit äußert, zeigt, dass diese Bundesregierung völlig außerstande ist, den Amis zu erklären, wo Schluss mit lustig ist. Dass Baerbock das nicht kann, ist klar; da ist der Kniefall vor allem US-Amerikanischen schon fest verdrahtet. Aber ein Sozialdemokrat wie Scholz sollte, wenn er schon kein soziales Gewissen hat, doch zumindest so viel politischen Instinkt besitzen, um zu erkennen, dass eine Runde Frieren für Kiew nicht auf dem Bestellzettel der Bundesbürger steht und die Reaktionen auf aufgezwungenes körperliches Leid nicht unbedingt freundlich ausfallen müssen.

Wenn Nuland nach Scholzes Finger greift, um zu testen, ob er schon fett genug zum Verzehr ist, sollte dieser wenigstens schlau genug sein, ihr wie Hans einen Hühnerknochen zu reichen. WIR brauchen diese Pipeline, nicht Russland. Scholz weiß das wohl. Aber Nulands Auftritt nach zu urteilen, hat er das höchstens in Onkel Joes Ohr geflüstert, statt es durchs Weiße Haus zu schreien: Finger weg von Nord Stream 2!

Keine Sorge, Frau Nuland, die Menschen hier können Sie nicht mit ein paar Keksen verführen, und sollte es kalt werden, wissen sie, an wen die Rechnung zu stellen ist. Dann könnte es passieren, dass die hier stationierten US-Truppen sich etwas wärmer anziehen müssen. Wäre ja nur ausgleichende Gerechtigkeit, ihnen dann die Versorgung mit Strom und Gas zu kappen.

Und denken Sie daran, wie die Geschichte mit dem Lebkuchenhaus endet. Vielleicht findet sich noch eine Gretel, die Sie wegen Ihrer außenpolitischen Verbrechen vor Gericht stellt. Wegen des Maidan-Putsches und den Tausenden Toten in seinem Gefolge. Und ein klein bisschen auch wegen der Bösartigkeit, uns hier Heizung und Strom abdrehen zu wollen. In meiner Fantasie werden Sie dann in ein kleines Hexenhäuschen verbannt, tief im Wald, ohne Lebkuchen oder Kekse, weit hinten in Sibirien.

RT DE bemüht sich um ein breites Meinungsspektrum. Gastbeiträge und Meinungsartikel müssen nicht die Sichtweise der Redaktion widerspiegeln.

Mehr zum Thema - Marktfetischismus in der Energieversorgung: Auf Europa wartet der ""perfekte Sturm""",https://de.rt.com/meinung/129862-lebkuchenhexe-im-weissen-haus/,Maidan in 2014 was a coup d'état
2,Spannungen verschärfen sich: Ukraine laut Selenskyj „bereit“ für Krieg mit Russland,"Während sich die Spannungen in der Schwarzmeerregion weiter verschärfen, erklärte der ukrainische Präsident Wolodymyr Selenskyj am Dienstagabend, die Ukraine sei „bereit“ für einen Krieg gegen Russland und warnte, das Land werde im Kriegsfalle „bis zum letzten Mann kämpfen“.

Selenskyj unterzeichnete außerdem ein neues Gesetz, das es dem ukrainischen Militär ermöglicht, seine Reservisten innerhalb von vierundzwanzig Stunden zu mobilisieren. Jenen, die die Einberufung verweigern, droht ein Strafverfahren. Das Gesetz wurde vom ukrainischen Generalstab vorgeschlagen.

Sondereinsatztruppen der ukrainischen Streitkräfte (Foto: Wikipedia/ArmyInform]

Selenskyjs aggressive Äußerungen fielen vor dem Hintergrund wachsender Nato-Aktivitäten nahe der russischen Grenze.

Am Mittwoch berichtete die russische Presse, dass zwei Nato-Flugzeuge – eine amerikanische P-8A Poseidon und eine britische RC-135W – und eine amerikanische Drohne mehrstündige Aufklärungsflüge nahe der Krim im Schwarzen Meer durchgeführt hatten.

Vor der rumänischen Schwarzmeerküste wurde ein französischer Flugzeugträger gesichtet, am Dienstag wurden russische Aufklärungsflugzeuge, Jäger und Bomber über der Ostsee von Nato-Trägerflugzeugen aus Estland, Lettland und Polen abgefangen. Am 19. April führten die Ukraine und der Nato-Mitgliedsstaat Rumänien gemeinsame Militärübungen im Schwarzen Meer durch.

Laut der Nesawisimaja Gaseta wurden mehr als zwanzig amerikanische Kampfflugzeuge der Typen F-16 und F-15 plötzlich von Großbritannien nach Polen verlegt. Ein russischer Militärexperte deutete an, dass die beiden amerikanischen Lenkwaffenzerstörer USS Donald Cook und USS Theodore Roosevelt „in der nördlichen Ägäis [unmittelbar jenseits des Schwarzen Meeres] an Manövern der Nato-Übung Ramstein Dust II 21 beteiligt sind.“ Letzte Woche hatten die USA die Entsendung von zwei Kriegsschiffen ins Schwarze Meer kurzfristig abgebrochen, doch nur wenige Tage später hatte stattdessen Großbritannien zwei Kriegsschiffe entsandt.

Russland hat gerade seine eigenen Militärübungen im Schwarzen Meer beendet, an der zwanzig Kriegsschiffe der Schwarzmeerflotte und mehr als 50 Kampfflugzeuge teilnahmen. Ein Großteil der Soldaten und des Kriegsgeräts, das der Kreml für die Militärübungen in die Region verlegt hat, soll auch dort bleiben.

Am Montag erklärte der Kreml, dass große Teile der Krim, darunter die Südhälfte, wo sich der Stützpunkt der russischen Schwarzmeerflotte befindet, sowie Teile des Schwarzen Meeres selbst, „für den Flugverkehr vorübergehend gefährlich“ seien. Russland hat auch die Passage zwischen dem Asowschen Meer und dem Schwarzen Meer vom 24. April bis zum 31. Oktober für ausländische Kriegsschiffe geschlossen.

Die Aktivitäten der Nato führen zu einer gefährlichen Verschärfung der Spannungen in einer Region, in der die militärische Lage ohnehin schon sehr unsicher ist. In den letzten Wochen verschärften sich die Kämpfe zwischen dem ukrainischen Militär und den von Russland unterstützten Separatisten in der Ostukraine.

Dort tobt ein Bürgerkrieg, seit im Februar 2014 ein von den USA und Deutschland unterstützter Putsch zum Sturz der prorussischen Regierung von Wiktor Janukowirsch geführt hat. Der Krieg hat schätzungsweise 14.000 Todesopfer gefordert und Millionen zur Flucht gezwungen. In diesem Jahr wurden bereits mehr als 30 ukrainische Soldaten getötet, im Vorjahr waren es insgesamt nur 50.

Am Montag wurde ein weiterer ukrainischer Soldat getötet. Nur wenige Stunden später trafen sich Vertreter der Ukraine, Russlands, Deutschlands und Frankreichs zu Neuverhandlungen über die gescheiterte Waffenruhe zwischen den ostukrainischen Separatisten und dem ukrainischen Militär. Berichten zufolge kamen die Verhandlungen zu keinem nennenswerten Ergebnis.

Unmittelbarer Hintergrund der jüngsten Eskalation der militärischen Zusammenstöße war die Entscheidung der ukrainischen Regierung, eine Offensive zur Rückeroberung des Donezbeckens und der „Rückholung“ der Krim umzusetzen. Die Halbinsel im Schwarzen Meer wurde von Russland im März 2014 nach dem Putsch in Kiew und einem Volksentscheid angegliedert, in dem die Mehrheit der Bewohner der Halbinsel für den Anschluss an Russland stimmte.

In den letzten Wochen hat die ukrainische Regierung unter Wolodymyr Selenskyj gegenüber den USA und der EU aggressiv auf eine beschleunigte Aufnahme in die Nato gedrängt. Doch der französische Präsident Emmanuel Macron und die deutsche Bundeskanzlerin Angela Merkel haben sich bisher geweigert, die Aufnahme der Ukraine in die Nato zu unterstützen.

Der ukrainische Botschafter in Deutschland hat angedroht, die Kiewer Regierung erwäge die „eigenständige“ Anschaffung von Atomwaffen, falls ihr Gesuch um Aufnahme in die Nato nicht erfüllt wird. Laut Berichten der russischen Presse bereitet das ukrainische Parlament auch einen Brief an den amerikanischen Kongress vor, in dem es den Status eines „wichtigen Nicht-Nato-Verbündeten“ („major non-NATO ally“, MNNA) beantragt.

Am Mittwoch erklärte der ukrainische Außenminister Dmitri Kuleba, er habe US-Außenminister Antony Blinken um „mächtige Mittel zur elektronischen Kriegsführung“ für die Konfrontation mit Russland gebeten. Er erklärte weiter, er habe die Außenminister der EU aufgefordert, Russland aus dem SWIFT-System auszuschließen, einem internationalen Kommunikationssystem für Banken und andere Finanzinstitute. Ein solcher Schritt könnte zum vollständigen Zusammenbruch des russischen Finanzsystems führen.

Die ukrainische herrschende Klasse verschärft auch ihre Kriegsvorbereitungen im Inland. Am Montag kündigte der ukrainische Sicherheitsdienst SBU „mehrstufige Antiterrorübungen“ im ganzen Land an. Die Ankündigung deutet darauf hin, dass sich die Regierung auf die Verhängung des Kriegsrechts vorbereitet: „Möglicherweise werden angesichts der Übungen in Teilen des Landes vorübergehend ein besonderes Regime sowie Einschränkungen oder Verbote für Fahrzeuge und Fußgänger, Ausweiskontrollen, Fahrzeuginspektionen, etc. eingeführt.“ Hierzu hatte der ehemalige Präsident Petro Poroschenko im Jahr 2018 einen Präzedenzfall geschaffen, als er nach einer Provokation im Asowschen Meer das Kriegsrecht verhängte.

Am Donnerstag diskutierte der ukrainische Präsident Wolodymyr Selenskyj bei einem Treffen mit dem Nationalen Sicherheits- und Verteidigungsrat über die militärische Bereitschaft des Landes. Er forderte die Bevölkerung auf, „nur den offiziellen Erklärungen unseres Generalstabs und des Präsidenten zu vertrauen“ und erklärte: „Das Militär ist bereit – das ist das wichtigste.“

Der Pressedienst von Kiew hatte zuvor eine Karte mit aktualisierten Bombenbunkern veröffentlicht und erklärt, die Regierung habe Gelder zum Bau von Zivilschutzstrukturen bereitgestellt, um die Bevölkerung im Kriegsfall aufzunehmen.

Die ukrainische herrschende Klasse ist sich bewusst, dass die Fortsetzung – ganz zu schweigen von der Ausweitung – des Kriegs in der Ostukraine zutiefst unpopulär ist. Deshalb arbeitet sie daran, die extreme Rechte zu mobilisieren, die bereits bei dem Putsch von 2014 und im anschließenden Bürgerkrieg eine zentrale Rolle spielte.

Letzte Woche hatte Innenminister Arsen Awakow, einer der einflussreichsten Politiker des Landes, der enge Beziehungen zur extremen Rechten unterhält, auf Facebook an diese Kräfte appelliert. Er nannte sie „Patrioten“ und rief sie in faschistischer Rhetorik auf, sich auf den Krieg und den Schutz des „Mutterlandes“ vorzubereiten. Awakow deutete an, die Ukraine würde besser dastehen als im Jahr 2014, weil sie seither von den USA Militärhilfe und Kriegsgerät im Wert von mehr als zwei Milliarden Dollar erhalten hat.

Als Innenminister kontrolliert Awakow die Nationalgarde des Landes, die 2014 gegründet wurde und u.a. das neofaschistische Asow- und Donbass-Bataillon beinhaltet. In den letzten Jahren spielte sein Ministerium eine zentrale Rolle dabei, die extrem rechten Kräfte im Land zu schützen und auszubauen. Organisationen wie das Asow-Bataillon und C-14 haben mehrere Mordanschläge auf Journalisten und ethnische Minderheiten durchgeführt und gingen nahezu straffrei aus.

Die ukrainische Presse verbreitet weiterhin die Vorstellung, die USA und die Nato würden die Ukraine in einem Krieg gegen Russland militärisch unterstützen. Besondere Aufmerksamkeit erhielten die jüngsten Äußerungen der amtierenden amerikanischen Botschafterin in der Ukraine Kristina Kvien, laut der die USA im Falle eines Krieges gegen Russland weitere Truppen in die Ukraine verlegen könnten.

Im Gespräch mit dem ukrainischen Premierminister Denys Schmychal erklärte Kvien: „Wir werden die Lage ständig aus und bewerten die Bedürfnisse der ukrainischen Seite. Und wir haben eine dauerhafte Präsenz von 160 amerikanischen Soldaten. Wenn sich das nach unserer Einschätzung ändern und die Zahl erhöht werden muss, werden wir dies überdenken.“

In der Masse der Bevölkerung herrscht großer Widerstand gegen einen offenen Krieg zwischen der Ukraine und Russland, der Millionen Menschenleben gefährden würde. Tausende Ukrainer sind an der Bürgerkriegsfront in der Ostukraine desertiert. Selenskyj selbst wurde im Jahr 2019 nur wegen des massiven Widerstands gegen die wütende antirussische Politik und Kriegstreiberei des früheren Präsidenten gewählt.

Doch unabhängig von der Entscheidung der USA und der europäischen imperialistischen Mächte zur Ukraine kann der imperialistische Kriegskurs nur durch die Schaffung einer internationalen sozialistischen Antikriegsbewegung der Arbeiter in ganz Osteuropa und der Welt gegen das überholte und barbarische kapitalistische System aufgehalten werden.",https://www.wsws.org/de/articles/2021/04/23/ukra-a23.html,Maidan in 2014 was a coup d'état
