,title,text,link,label
26,Warum ermitteln die USA gegen einen amerikanischen Faschisten wegen Kriegsverbrechen in der Ukraine?,"Oberflächlich betrachtet ergibt es keinen Sinn, dass sich die USA gegen einen ihrer eigenen antirussischen Stellvertreterkämpfer wenden, aber hinter der Geschichte steckt viel mehr.

Präsident Putin schrieb im Sommer in einem Artikel über die Beziehungen zwischen Russland und der Ukraine, dass das Nachbarland unter „direkter Kontrolle von außen“ stehe, was der ehemalige Staatschef und amtierende stellvertretende Vorsitzende des Sicherheitsrats Medwedew Anfang dieser Woche wiederholte. Das ist eine zutreffende Feststellung und bedeutet, dass alles, was dort geschieht, auf die eine oder andere Weise mit dem amerikanischen Schirmherrn der Ukraine zusammenhängt. Diese Erkenntnis macht es umso merkwürdiger, dass Buzzfeed letzte Woche berichtete, dass das FBI und das Justizministerium (DOJ) gegen einen amerikanischen Faschisten wegen Kriegsverbrechen im Lande ermitteln. Oberflächlich betrachtet ergibt es keinen Sinn, dass sich die USA gegen einen ihrer eigenen antirussischen Stellvertreterkämpfer wenden, aber hinter der Geschichte steckt viel mehr.

Bevor ich das erkläre, empfehle ich dem Leser, sich den sehr ausführlichen Bericht des Blattes in voller Länge durchzulesen. Buzzfeed kann auf keinen Fall als „russlandfreundliches“ Unternehmen betrachtet werden, daher ist es sehr überraschend, dass sie über diese offiziell unbestätigte Untersuchung berichten, die angeblich im April 2017 vom FBI eingeleitet wurde. Gegen Craig Lang, um den es in diesem Fall geht, wurde noch keine Anklage wegen Kriegsverbrechen erhoben, obwohl er in den USA wegen eines Doppelmordes an einem Ehepaar in Florida angeklagt wird, für den seine Regierung versucht, ihn aus der Ukraine auszuliefern zu lassen. Er versucht, diese Entwicklung zu behindern, indem er behauptet, dass er wegen Kriegsverbrechen angeklagt werden würde, was laut Buzzfeed in Erwägung gezogen wird, um ihn zum ersten Amerikaner zu machen, der dafür vor Gericht gestellt wird.

Laut ihrer Darstellung der Geschehnisse verübte Lang als Freiwilliger des neofaschistischen „Pravy Sektor“ (Rechter Sektor) in der Ostukraine eine Reihe von Kriegsverbrechen gegen Nichtkombattanten. Sein Anwalt streitet diese Anschuldigungen natürlich ab, aber der Bericht von Buzzfeed ist überzeugend und scheint vollständig auf Fakten zu beruhen. In jedem Fall verdient diese Entwicklung eine Erklärung, denn sie ist für viele Beobachter, die niemals erwartet hätten, dass die USA gegen einen ihrer eigenen Bürger wegen der Kriegsverbrechen vorgehen, die sie im Namen des Neofaschismus in der Ostukraine begangen haben, verständlicherweise verwirrend. Was wirklich passiert, ist, dass die USA versuchen, sprichwörtlich mehrere Fliegen mit einer Klappe zu schlagen.

Erstens stellt Buzzfeed zu Recht fest, dass „die außergewöhnliche Untersuchung auch ein weiteres Kästchen für das Justizministerium abdeckt: einen Fall gegen Rechtsextremisten. Die Biden-Administration hat gesagt, dass der Kampf gegen Extremismus höchste Priorität hat“. Das stimmt, aber es ist nicht die Hauptmotivation, sondern nur eine zusätzliche. Auch die Ankündigung der Biden-Administration, die so genannten „Menschenrechte“ in den Vordergrund ihres politischen Kalküls zu stellen, ist nicht der Hauptgrund, da sie diesen Standard im vorliegenden Fall selektiv anwendet. Nichtsdestotrotz appelliert die berichtete Untersuchung an diejenigen im In- und Ausland, die die öffentliche Haltung der amtierenden Regierung in diesen Fragen unterstützen.

Die größere Dynamik, die hier im Spiel ist, besteht darin, dass sich die USA in gewisser Weise von der Ukraine distanzieren und dem Land nicht mehr den Freibrief geben, den sie einst hatten. Amerika unterstützt das Land zwar immer noch in vielen Fragen, aber nicht mehr bedingungslos. Die Biden-Administration hat ein innenpolitisches Eigeninteresse daran, die Vorwürfe der Opposition abzulenken, der Präsident und sein Sohn hätten sich in diesem Land ungebührlich verhalten. Indem sie Berichten zufolge den beispiellosen Schritt in Erwägung zieht, einen ihrer eigenen faschistischen Bürger für die Kriegsverbrechen anzuklagen, die er angeblich an antifaschistischen Nichtkämpfern in der Ostukraine begangen hat, zeigt die Biden-Regierung, dass sie endlich zumindest eine Person für ihre Taten zur Rechenschaft zieht. Das ist nicht viel, aber es ist ein symbolischer Schritt in die richtige Richtung.

Dies folgt dem Trend, dass die USA Anfang des Jahres zum Entsetzen der Ukraine auf die meisten Nord Stream II-Sanktionen verzichteten, was bewies, dass dieses osteuropäische Land und das benachbarte Polen tatsächlich die ersten waren, die von der Biden-Regierung im Stich gelassen wurden, bevor sie einige Monate später schockierenderweise Afghanistan im Stich ließ. Diese Entwicklungen stehen im Einklang mit dem eisigen Tempo der Bemühungen der USA und Russlands, einen so genannten „Nichtangriffspakt“ zwischen ihnen auszuhandeln, um ihren geopolitischen Wettbewerb verantwortungsvoll zu regeln. Diese Strategie war nicht sehr erfolgreich, wird aber in begrenztem Umfang weiterverfolgt, wie der jüngste Besuch von US-Unterstaatssekretärin Nuland in Moskau zeigt. Er hat nicht viel gebracht, wurde aber von den USA als konstruktiv begrüßt.

Die Optik ist im Bereich der internationalen Beziehungen sehr wichtig, und der angebliche Versuch der Biden-Administration, einen ihrer eigenen faschistischen Bürger wegen Kriegsverbrechen in der Ostukraine anzuklagen, zeigt, dass sich im strategischen Kalkül der USA gegenüber Kiew etwas ändert. Es deutet darauf hin, dass Washington es nicht länger gutheißt, dass Amerikaner auf der Seite der neofaschistischen Kräfte in der Ostukraine kämpfen, und dass es beabsichtigt, an Lang ein öffentlichkeitswirksames und beispielloses Exempel zu statuieren, falls er erfolgreich von der Ukraine ausgeliefert werden sollte. Auch wenn dies im Großen und Ganzen nur ein sehr begrenzter Fortschritt ist, so ist er doch zu begrüßen, denn er bestätigt, was Russland schon seit Jahren sagt, nämlich dass der Bürgerkrieg von faschistischen Kräften geführt wird.

Allein die Tatsache, dass ein demokratischer Präsident, dessen Partei heutzutage für ihre rabiate Russophobie bekannt ist, Berichten zufolge in Erwägung ziehen würde, Moskau einen solch enormen Soft-Power-Sieg zu bescheren, spricht Bände darüber, was derzeit hinter den Kulissen wirklich vor sich gehen könnte. Das bedeutet zwar nicht, dass die beiden Großmächte ihren spekulativen „Nichtangriffspakt“ erfolgreich aushandeln werden, da vieles passieren kann, um dieses Szenario zu vereiteln, aber es ist dennoch ein bedeutender Schritt, der unter der Trump-Administration politisch nicht möglich gewesen wäre, auch wenn das FBI dieses ehemaligen Staatschefs Berichten zufolge die Ermittlungen eingeleitet hat. Dies deutet darauf hin, dass Biden – fast schon kontraintuitiv – mehr politischen Spielraum hat, um an dieser vielversprechenden Front voranzukommen, als Trump es jemals konnte.",https://uncutnews.ch/warum-ermitteln-die-usa-gegen-einen-amerikanischen-faschisten-wegen-kriegsverbrechen-in-der-ukraine/,The West controls Ukraine and uses it to its advantage
27,"Polen und die Ukraine, nicht Afghanistan, waren die ersten US-Verbündeten, die von Biden im Stich gelassen wurden","Es war die ganze Zeit abzusehen, dass Biden einen Teil von Trumps außenpolitischer Vision umsetzen würde, indem er die Interessen seiner „Verbündeten“ im Interesse des „größeren Wohls“ aufgibt, um China im asiatisch-pazifischen Raum aktiv „einzudämmen“.

Die Welt spricht über die nächsten US-Verbündeten, die von Präsident Biden im Stich gelassen werden, nachdem er seine afghanischen Verbündeten während Amerikas panischem Rückzug aus dem Land schändlich im Stich gelassen hat. Einige Kommentatoren glauben, dass die Ukraine der nächste sein könnte, aber in Wirklichkeit waren die Ukraine und Polen die ersten Verbündeten der USA, deren Interessen trotz Bidens Versprechen, die Außenpolitik seines Landes nicht auf die machiavellistische Art und Weise zu führen, wie es Trump getan hat, im Namen des so genannten „höheren Wohls“ verraten wurden. Ich schreibe schon seit einiger Zeit darüber, aber für diejenigen, die meine Arbeit in den letzten Monaten nicht genau verfolgt haben, hier meine wichtigsten Analysen mit einer kurzen Zusammenfassung:

* 8. April: „Why Does Ukraine Want War?“

Die Ukraine provozierte Feindseligkeiten im Donbass in einem verzweifelten Versuch, für die neue US-Regierung relevant zu bleiben, und zwar auf Geheiß einiger antirussischer Mitglieder der ständigen militärischen, geheimdienstlichen und diplomatischen Bürokratie („tiefer Staat“), die Bidens Bemühungen um Russland hinter den Kulissen sabotieren wollten.

* 14. April: „Poland Must Wake Up To The Threat Of German Hybrid War“

Deutschland hat aktiv als Amerikas „Lead From Behind“-Vertreter für den Sturz der konservativ-nationalistischen polnischen Regierung mit Mitteln des hybriden Krieges gearbeitet, die mit Berlins Unterstützung der Farbrevolution in seinem Nachbarland verbunden sind.

* 24. April: „What Explains The Latest De-Escalation In Donbass?“

Russland ist nicht in die Falle getappt, die ihm von feindseligen Elementen des amerikanischen „tiefen Staates“ gestellt wurde, obwohl ein beträchtlicher Teil des Verdienstes für diese etwas überraschende Deeskalation auch Biden gebührt, da er die Dinge nicht noch schlimmer gemacht hat, wie viele zu diesem Zeitpunkt vorausgesagt hatten.

* 2. Juni: „Poland’s Counterproductive Foreign Policy Is Responsible For Its Present Predicament“

Polen war schockiert über Bidens Entscheidung, die Nord-Stream-II-Sanktionen der USA größtenteils aufzuheben, aber es hätte dies seit seinem Amtsantritt kommen sehen und aktiv damit beginnen müssen, seine Außenpolitik zu diversifizieren, anstatt weiterhin vollständig von Amerikas „Wohlwollen“ abhängig zu sein.

* 11. Juni: „Towards Increasingly Complex Multipolarity: Scenarios For The Future“

Ich sagte voraus, dass die USA die Interessen einiger ihrer Verbündeten wie Polen und der Ukraine „kompromittieren“ würden, um das „größere Wohl“ einer pragmatischen Reparatur der Beziehungen zu Russland zu erreichen und ihre Bemühungen stärker auf die aktive „Eindämmung“ Chinas im asiatisch-pazifischen Raum zu konzentrieren.

* 15. Juni: „How Serious Are Poland’s Grand Strategic Disagreements With The US?“

Zu diesem Zeitpunkt wurde immer deutlicher, dass Polen und die USA einige unüberbrückbare großstrategische Differenzen haben, die weit über ihre gemeinsamen militärischen Interessen gegenüber Russland hinausgehen, aber der aufstrebende mitteleuropäische Hegemon hatte noch keine entscheidenden Schritte unternommen, um seine Außenpolitik daraufhin neu zu justieren.

* 24. Juni: „Polish-US Missile Defense Co-Op Is A Strategic Smokescreen“

Um Polen präventiv daran zu hindern, irgendetwas Dramatisches zu unternehmen, das seine strategische Unabhängigkeit stärken könnte, setzten die USA ihre früheren „Raketenabwehr“-Pläne fort, die dem Zweck dienten, Polen in ihren Klauen zu halten und die Führung des Landes in dem Glauben zu lassen, die USA seien nach wie vor ihr „zuverlässiger“ Verbündeter.

* 12. Juli: „Former Polish PM Tusk Ridiculously Alleged A Kaczysnski-Putin Conspiracy“

Der deutsche Stellvertreter Donald Tusk hat den hybriden Krieg gegen Polen eskalieren lassen, indem er behauptete, dass der bösartige russophobe graue Kardinal des Landes insgeheim eine Marionette des russischen Präsidenten Putin sei. Damit durchkreuzte er präventiv die Pläne seines Ziels, dasselbe über ihn zu behaupten, nachdem er ins Land zurückgekehrt war, um die Farbenrevolution anzuführen.

* 15. Juli: „It’s Time For A Polish-Russian ‚Non-Aggression‘ Pact In Belarus & Ukraine“

Angesichts des zunehmenden Drucks, den der Hybride Krieg auf Polen ausübt, ist das Pragmatischste, was Polen tun könnte, einen so genannten „Nichtangriffspakt“ mit Russland in ihren sich überschneidenden „Einflusssphären“ zu schließen, um die Bemühungen seiner Sicherheitsdienste stärker auf die Verteidigung gegen die gemeinsame deutsch-amerikanische Regimewechselkampagne zu konzentrieren.

* 19. Juli: „Poland Should Follow Ukraine’s Lead By Using China To Balance The US“

So unerwartet es für die meisten Beobachter auch war, die von den USA kontrollierte Marionettenregierung der Ukraine hat tatsächlich begonnen, ernsthafte Schritte zu unternehmen, um China als „ausgleichende“ Kraft gegen Amerika einzusetzen, was Polen dazu veranlasst haben sollte, diesem Beispiel zu folgen, um den USA zu zeigen, wie unzufrieden es mit dem laufenden Hybridkrieg ist.

* 26. Juli: „The US-German Hybrid War Against Poland Is Intensifying“

Polens mangelnde Entschlossenheit, sich gegen den gemeinsamen deutsch-amerikanischen hybriden Krieg zu verteidigen, hat seine nominellen „Verbündeten“ nur dazu ermutigt, ihre Regimewechsel-Kampagne zu intensivieren, was die Lage für die angeschlagene konservativ-nationalistische Regierung noch viel schlimmer machen könnte.

* 29. Juli: „The West Is Pressuring Poland & Russia Due To Their Conservative-Nationalist Values“

Polen und Russland sitzen gegenüber dem Westen interessanterweise im selben Boot, da der Westen beide wegen ihrer konservativ-nationalistischen Werte unter Druck setzt, was Warschau noch nicht erkannt hat und daher erklärt, warum es immer noch in einem Schockzustand ist, nachdem sich seine so genannten „Verbündeten“ so entschieden gegen es gewandt haben.

* 13. August: „Ukrainian Ethno-Fascism vs. Russian Multiculturalism“

Die ukrainische Antwort auf Amerikas strategischen Verrat an ihren Interessen bestand nicht darin, pragmatisch eine mögliche Annäherung an Russland zu erkunden, wie es die ukrainische Führung mit etwas Verstand hätte tun sollen, sondern in einer kontraproduktiven Verdoppelung ihrer russophoben Politik.

* 12. August: „Unexpected Trouble In The Three Seas States Might Cause Them To Rethink Their Policies“

Die Kombination aus dem Druck des deutsch-amerikanischen Hybridkriegs und der unerwarteten Migrantenkrise aus Weißrussland könnte Polen endlich dazu veranlassen, seine selbstzerstörerische Regionalpolitik zu überdenken, die darin besteht, als antirussische Marionette Amerikas zu fungieren, nachdem es für diese Rolle buchstäblich keine Belohnung und auch keine Erleichterung von dem auf das Land ausgeübten Druck zum Regimewechsel erhält.

———-

Nachdem unbestreitbar feststeht, dass Polen und die Ukraine die ersten Verbündeten der USA waren, die von Biden im Stich gelassen wurden, ist es nun an der Zeit, ein wenig mehr über die missliche Lage der Ukraine zu erfahren. Präsident Zelensky will sich Ende des Monats endlich mit seinem amerikanischen Amtskollegen treffen, aber viele Beobachter fragen sich, warum das überhaupt so lange dauert. Ein möglicher Grund, abgesehen davon, dass der amerikanische Staatschef den Verbündeten seines Landes absichtlich schlecht behandelt, ist, dass er sich wegen der zahlreichen Skandale, die ihn mit diesem Land in Verbindung bringen, einfach schämt, z. B. der Skandal um seinen Sohn Hunter in Burma und Bidens Vereinbarung mit Poroschenko, den ehemaligen Generalstaatsanwalt Schokin zu entlassen, der den erstgenannten Skandal untersuchte.

Biden wollte auch, dass Zelenskij sich beugt und akzeptiert, dass Amerika die Interessen der Ukraine als Teil des „größeren Ganzen“ im Zusammenhang mit der Wiederherstellung der Beziehungen zu Russland „kompromittiert“, um die Bemühungen der USA aktiver auf die „Eindämmung“ Chinas auszurichten. Der ukrainische Staatschef fühlte sich verständlicherweise von Biden betrogen und begann, das Vertrauen in die Zuverlässigkeit der USA als Verbündeter zu verlieren, was erklärt, warum sich sein Land in letzter Zeit verstärkt an China gewandt hat. Dennoch kann nichts, was Kiew tun könnte, seine Interessen vollständig schützen, wenn Washington mit Moskau einen Deal über die Ostukraine abschließt, wie einige Kommentatoren jetzt im Rahmen der schrittweisen Annäherung vermuten.

Auch Polen wurde durch Bidens pragmatische Deals mit Russland in die Enge getrieben und hat keine realistischen Möglichkeiten, seine Interessen zu verteidigen, wenn sie vom amerikanischen Staatschef „verraten“ werden. Im Gegensatz zur Ukraine, deren konservativ-nationalistische Werte von den USA unterstützt werden, weil sie die extreme Form des Ethnofaschismus annehmen, der als Waffe eingesetzt werden kann, um den russischen Einfluss dort in Schach zu halten, werden die vergleichsweise milderen Werte der polnischen Regierung als Bedrohung für das gesamte westliche Projekt angesehen, weil sie andere EU-Mitglieder beeinflussen und so die Pläne der USA untergraben können, die liberal-globalistische Ideologie Deutschlands den Kontinent dominieren zu lassen, um seine Länder stellvertretend zu kontrollieren.

Polen und die Ukraine sind also der Gnade Amerikas ausgeliefert. Ihre Interessen wurden von ihrem „Verbündeten“ verraten, noch bevor Biden die afghanischen „Verbündeten“ seines Landes im Stich ließ. Beobachter sollten sich dieser Tatsache bewusster werden, denn sie zeigt, dass niemand von den Geschehnissen in diesem südasiatischen Land hätte überrascht werden dürfen. Die ganze Zeit über war klar, dass Biden einen Teil von Trumps außenpolitischer Vision umsetzt, die darin besteht, die Interessen seiner „Verbündeten“ zugunsten des „größeren Wohls“ aufzugeben, um China im asiatisch-pazifischen Raum aktiver „einzudämmen“. Es bleibt abzuwarten, wie viele weitere „Kollateralschäden“ die „Verbündeten“ der USA durch diese Politik erleiden werden, aber die Existenz einer solchen machiavellistischen Politik lässt sich nicht mehr leugnen.",https://uncutnews.ch/polen-und-die-ukraine-nicht-afghanistan-waren-die-ersten-us-verbuendeten-die-von-biden-im-stich-gelassen-wurden/,The West controls Ukraine and uses it to its advantage
28,"Putin an Biden: „Finnlandisieren“ Sie die Ukraine, oder wir werden es tun","Finnlandisierung ist ein politisches Schlagwort, das die machtpolitischen Verhältnisse zweier benachbarter Staaten beschreibt. Es wird für den Einfluss verwendet, den ein mächtiger Nachbarstaat auf seinen kleineren Nachbarstaat und dessen Politik ausübt. Der Begriff entstand im Kalten Krieg als Kritik an der Politik der sozialliberalen Regierung der Bundesrepublik Deutschland gegenüber der Sowjetunion („Ostpolitik“). Das Schlagwort bezieht sich auf die Bemühungen eines Landes, Neutralität zu wahren und gute Beziehungen zu einem mächtigen Nachbarstaat zu pflegen, wie es während des Ost-West-Konfliktes von Finnland gegenüber der Sowjetunion praktiziert wurde. Quelle

Entweder geben uns die USA und die NATO „rechtliche Garantien“ dafür, dass die Ukraine niemals der NATO beitritt oder zu einem Stützpunkt für Waffen wird, die Russland bedrohen können – oder wir gehen selbst hinein und garantieren es.

Das ist die Botschaft, die der russische Präsident Wladimir Putin sendet, unterstützt von den 100 000 Soldaten, die Russland an den Grenzen der Ukraine zusammengezogen hat.

Letzte Woche hat Putin im Kreml seine rote Linie gezogen:

Die Bedrohung an unseren westlichen Grenzen nimmt … zu, wie wir bereits mehrfach gesagt haben. … In unserem Dialog mit den Vereinigten Staaten und ihren Verbündeten werden wir auf der Ausarbeitung konkreter Vereinbarungen bestehen, die jede weitere Osterweiterung der NATO und die Aufstellung von Waffensystemen in unmittelbarer Nähe des russischen Territoriums verbieten.

Das kommt einem Ultimatum nahe. Und NATO-Generalsekretär Jens Stoltenberg gab dem russischen Präsidenten für dieses Ultimatum die Rückhand:

Nur die Ukraine und 30 NATO-Verbündete entscheiden, wann die Ukraine bereit ist, der NATO beizutreten. … Russland hat kein Veto, Russland hat kein Mitspracherecht, und Russland hat kein Recht, eine Einflusssphäre zu errichten und zu versuchen, seine Nachbarn zu kontrollieren.

Doch Großmächte haben schon immer Einflusssphären geschaffen. Der chinesische Präsident Xi Jinping beansprucht praktisch das gesamte Südchinesische Meer, an das ein halbes Dutzend Staaten angrenzt. Seit 200 Jahren haben die Vereinigten Staaten die Monroe-Doktrin verkündet, die unsere Hemisphäre für neue Kolonisationen tabu macht.

Außerdem möchte Putin mit dem wahren Entscheider der Frage sprechen, ob die Ukraine der NATO beitritt oder Waffen erhält, die Russland bedrohen können. Und der Entscheider ist nicht Jens Stoltenberg, sondern Präsident Joe Biden.

In der Raketenkrise vor 60 Jahren zwangen die USA mit ihrer „Quarantäne“ Kubas und ihrer strategischen und taktischen Überlegenheit in der Karibik Nikita Chruschtschow, seine ballistischen Mittelstreckenraketen, die Washington erreichen konnten, von Fidel Castros Insel abzuziehen.

Andernfalls, so wurde Moskau zu verstehen gegeben, würden wir unsere Luft- und Seemacht nutzen, um seine Raketen zu zerstören, und die Marineinfanterie schicken, um die Arbeit zu beenden.

Als Chruschtschow ein Gegenangebot für den Abzug der Jupiter-Raketen aus der Türkei annahm, erfüllte er die Forderung von Präsident John F. Kennedy. Russlands Raketen wurden abgezogen. Und Kennedy wurde als Sieger des Kalten Krieges gefeiert.

Jetzt werden wir aufgefordert, Russlands Forderungen in der Ukraine nachzukommen, oder Russland wird in die Ukraine eindringen und die Bedrohung selbst neutralisieren.

Die Vorgeschichte?

Als der Warschauer Pakt zusammenbrach und die UdSSR vor drei Jahrzehnten zerfiel, zog Russland alle seine Streitkräfte aus Mittel- und Osteuropa ab. Moskau glaubte, sich mit den Amerikanern auf eine Vereinbarung geeinigt zu haben.

Demnach sollten die beiden deutschen Staaten wiedervereinigt werden. Die russischen Truppen sollten aus Ostdeutschland, Polen, der Tschechoslowakei, Ungarn, Bulgarien und Rumänien abgezogen werden. Und es würde keine NATO-Erweiterung in Osteuropa geben.

Wenn Amerika diese Zusage gemacht hat, dann wurde dieses Versprechen gebrochen. Denn innerhalb von 20 Jahren hatte die NATO alle Staaten des Warschauer Paktes sowie die ehemaligen Sowjetrepubliken Litauen, Lettland und Estland in das Bündnis aufgenommen.

Neocons und republikanische Falken wie der inzwischen verstorbene John McCain versuchten, die Ukraine und zwei weitere ehemalige Sowjetrepubliken, nämlich Georgien und Moldawien, in die NATO aufzunehmen.

Putin, der in der späten Sowjetära beim KGB diente und den Zusammenbruch der UdSSR als die „größte geopolitische Katastrophe“ des 20: Genug ist genug.

Übersetzt:

Bis hierher und nicht weiter! Die Ukraine wird weder Mitglied der NATO noch ein militärischer Verbündeter und Partner der Vereinigten Staaten sein, noch eine Basis für Waffen, die Russland innerhalb von Minuten treffen können. Für uns ist damit eine rote Linie überschritten. Und wenn die NATO die Ukraine für einen Konflikt mit Russland aufrüstet, behalten wir uns das Recht vor, zuerst zu handeln. Entweder wir machen die Ukraine finnisch, oder wir machen es!

Das Problem für Biden?

In der Ukraine und in Georgien hat Russland, wie wir im Krieg von 2008 gesehen haben, eine taktische und strategische Überlegenheit, wie wir sie 1962 in Kuba hatten. Außerdem ist die Ukraine zwar für Russland lebenswichtig, war aber nie lebenswichtig für uns.

Als Präsident Franklin D. Roosevelt 1933 die UdSSR von Joseph Stalin anerkannte, war Moskau mit der Zwangskollektivierung der landwirtschaftlichen Betriebe in der Ukraine beschäftigt, die eine Hungersnot und den Tod von Millionen Menschen zur Folge hatte. Wir Amerikaner taten nichts, um dies zu verhindern.

Während des Kalten Krieges hat Amerika nie auf die Unabhängigkeit der Ukraine gedrängt. Obwohl wir feierten, als sich die baltischen Staaten und die Ukraine von Moskau loslösten, betrachteten wir ihre Unabhängigkeit nie als vitale Interessen, für die Amerika bereit sein sollte, in den Krieg zu ziehen.

Ein Krieg der USA mit Russland wegen der Ukraine wäre für alle drei Nationen eine Katastrophe. Auch könnten die USA nicht auf Dauer die Unabhängigkeit eines 5.000 Meilen entfernten Landes garantieren, das nicht nur eine lange Grenze mit Mütterchen Russland hat, sondern auch eine gemeinsame Geschichte, Sprache, Religion, Ethnie und Kultur.

Die USA werden nicht in den Krieg ziehen, wenn sie vor die Wahl gestellt werden, entweder Russlands Forderung zu akzeptieren, dass sich die NATO aus der Ukraine heraushält, oder Russland einzugreifen.

Biden sollte Putin sagen: Die USA werden keine NATO-Kriegsgarantien für den Kampf um die Ukraine ausstellen.",https://uncutnews.ch/putin-an-biden-finnlandisieren-sie-die-ukraine-oder-wir-werden-es-tun/,"The West is not interested in dealing with Ukraine, moreover, solving its problems."
