,title,text,link,label
41,Ukraine-Update: Ausbau der Diktatur und Vorbereitung eines großen Krieges im Donbass – Anti-Spiegel,"Da meine letzte Zusammenfassung über die Lage in der Ukraine schon wieder zwei Wochen her ist, ist es höchste Zeit, auf die Entwicklungen im März einzugehen. Auch wenn das Land in den westlichen Medien derzeit keine Rolle spielt, finden dort dramatische Entwicklungen statt.

Von dem, was derzeit in der Ukraine stattfindet, werden deutschen „Qualitätsmedien“ nicht berichten. Es ist aber davon auszugehen, dass sie demnächst – spätestens im Mai – über neue heftige Kämpfe im Donbass berichten werden, ohne die derzeit stattfindenden Entwicklungen zu erwähnen, die dazu geführt erst geführt haben. Und da die Leser der „Qualitätsmedien“ von all dem nichts wissen, wird es umso leichter, Russland die Schuld an den neuen Kämpfen zu geben. Daher fasse ich die Entwicklungen der letzten zwei Wochen hier zusammen.

In meiner letzten Zusammenfassung habe ich darüber berichtet, wie der ukrainische Präsident Selensky nach der Amtseinführung von US-Präsident Biden im Eiltempo die Diktatur in der Ukraine ausbaut. Er hat die letzten regierungskritischen Fernsehsender verboten, hunderte kritische Internetseiten gesperrt und sogar den Oppositionsführer im Parlament enteignet.

Selensky nutzt für sein Vorgehen keine Gesetze. Alles, was er derzeit tut, ist in der Ukraine ungesetzlich. All seine Maßnahmen begründet er mit „Sanktionen“, die der Sicherheitsrat der Ukraine fordert. Sanktionen sind aber in keinem Gesetz vorgesehen, nach dem Gesetz müssten Gerichte die Entscheidungen treffen, die Selensky nun in Form von Dekreten verkündet und umsetzen lässt. Daher ist es nicht übertrieben, von einer Diktatur zu sprechen, wenn der Präsident der Ukraine sich nicht einmal mehr die Mühe macht, sich auch nur zum Schein auf geltendes Recht zu berufen. Aus dem Grund wurden auch zuerst die letzten regierungskritischen Medien geschlossen, damit darüber in dem Land niemand mehr berichten kann.

Der Ausbau der Diktatur in der Ukraine

Nachdem die letzten regierungskritischen Fernsehsender geschlossen waren, haben Journalisten der verbotenen Sender noch einmal den Versuch unternommen, einen neuen unabhängigen Fernsehsender zu gründen. Er wurde bereits nach weniger als einer Stunde Sendebetrieb abgeschaltet, nachdem der Chef des ukrainischen Sicherheitsrates dem Sender ebenfalls Sanktionen angedroht hatte. Selensky fügte dem hinzu, dass er dafür kämpfe, dass diese Sender auch im Internet „lebenslang blockiert“ werden.

Um das zu erreichen, hat die ukrainische Regierung sich mehrmals an YouTube gewandt, damit deren Programm auch dort gesperrt wird. Erstaunlicherweise hat YouTube sich dagegen erst einmal gesträubt. Daher hat Kiew mitgeteilt, man setze darauf, dass auch die USA sich den Kiewer „Sanktionen“ anschließen, um YouTube über diesen Weg dazu zu zwingen, die Accounts der Sender zu blockieren.

Geradezu wie Realsatire wirkt vor den Hintergrund die Aussage Selenskys, in Kiew solle ein internationales Zentrum für den Kampf gegen Desinformation geschaffen werden. Diese Zentrum solle nicht nur gegen „ausländische Propaganda“ vorgehen, sondern auch gegen die innenpolitischen Gegner. Selensky sagte weiter:

„Sie (die innenpolitischen Gegner) sind bereit, bei ihrem Kampf um Popularität die Sicherheit, das Leben und die Gesundheit der Ukrainer zu gefährden. Der Informationskrieg bedeutet nicht nur Lügen, es geht um Angst, Panik und Aggression, die sich mit jedem Like und jedem Repost vermehren. Das ist schädlicher Spam, der künstlich von sogenannten Meinungsführern erstellt wird.“

Was das in der Praxis bedeutet, hat der Oppositionsführer im Parlament, Viktor Medwendschuk, bereits bei seiner Enteignung aufgrund der „Sanktionen“ Selenskys am eigenen Leib erfahren. Aber er wird weiter unter Druck gesetzt. Der ukrainische Geheimdienst hat ihn zum Verhör geladen und wirft ihm Hochverrat vor.

Jetzt trifft es übrigens auch den ukrainischen Oligarchen Kolomoisky. Kolomoisky war es, der mit seinen Fernsehsendern den Wahlsieg von Selensky erst möglich gemacht hat. Aber da Kolomoisky ein Rivale von Joe Bidens altem Kumpel Poroschenko ist, hat die neue US-Regierung jetzt gegen Kolomoisky Sanktionen verhängt, die Selensky begrüßt hat.

Selensky begibt sich damit endgültig in die volle Abhängigkeit der USA, denn er hat keine eigene Hausmacht. Seine Partei und seine Popularität hatte er Kolomoisky und dessen Geld zu verdanken. Im Regierungsapparat (auch im Sicherheitsrat, der nun im Land „Sanktionen“ verhängt) sitzen aber noch die Getreuen von Poroschenko. Das bedeutet, dass die Ukraine zwar gerade zu einer Diktatur ausgebaut wird, dass Selensky aber nicht der mächtige Diktator ist, sondern nur eine Marionette in den Händen von Poroschenko und Joe Biden: Offiziell schmiegt sich Selensky an die USA, im Land treffen aber schon wieder die Leute von Poroschenko die Entscheidungen, die Selensky dann in Form von Präsidialdekreten umsetzt. Und Poroschenko ist seinerseits wiederum von Joe Biden abhängig, mit dem er früher schon sehr gute Geschäfte gemacht hat.

Kriegsvorbereitungen im Osten

Der Beschuss im Donbass nimmt wieder zu. Ende Februar wurde sogar ein Chemiewerk im Donbass von der ukrainischen Armee mit Granatwerfern beschossen. Allerdings waren die Schäden gering.

Aber die Verschärfung der Lage passt ins Bild, denn aus Kiew hört man inzwischen ganz offen, dass die Ukraine sich nicht mehr an das Minsker Abkommen gebunden fühlt. In Kiew wurde bereits verkündet, man habe zusammen mit Deutschland und Frankreich einen neuen Friedensplan ausgearbeitet. Vom Minsker Abkommen wird schon nicht mehr gesprochen. Gleichzeitig droht man in Kiew, sollte Moskau dem Plan nicht zustimmen, müsse Kiew sich verteidigen, also im Donbass eine militärische Lösung suchen.

Über diesen neue Friedensplan ist nichts bekannt, außer dass in Kiew alle über ihn reden. Es gibt keine Reaktionen aus Deutschland und Frankreich, die laut Kiew an dem Plan mitgearbeitet haben. Und in Moskau wird mitgeteilt, man habe die Meldungen aus Kiew zwar gehört, aber einen Plan habe Kiew bisher nicht geschickt.

Kiew will den großen Krieg

Während Offizielle in Kiew von dem ominösen Friedensplan reden, den bisher niemand gesehen hat, spricht Leonid Krawtschuk, der Vertreter der Ukraine bei den Verhandlungen im Normandie-Format bestehend aus Deutschland, Frankreich, der Ukraine und Russland, bereits von einem großen Krieg. Er erklärte, dass ein großer Konflikt möglich sei, „wenn Moskau seinen Appetit nicht zügelt“ und fügte hinzu:

„Ich bin davon überzeugt, dass sich die USA an dieser Frage beteiligen sollten, da der Konflikt im Donbass nicht nur eine ukrainische und europäische Frage ist, sondern eine Frage eines möglichen groß angelegten Konflikts.“

Die ukrainische Seite spricht damit offen davon, dass sie den seit letztem Sommer einigermaßen funktionierenden Waffenstillstand brechen will. Mehr noch: Die Ukraine möchte den Konflikt zu einem bewaffneten Konflikt zwischen den USA und Russland machen.

Aber auch das reicht Kiew nicht aus, man möchte den Donbass zum Ausgangspunkt eines Krieges der Nato gegen Russland machen. Olga Stefanischina, Vize-Premierministerin der Ukraine, hat gefordert, die Ukraine müsse Positionen im Nato-Stab bekommen. In einer Pressemeldung der ukrainischen Regierung über entsprechende Gespräche mit der Nato heißt es weiter:

„Die Seiten haben die strategischen Vektoren der Integration der Ukraine in die NATO im militärischen Bereich erörtert, insbesondere im Rahmen des Enhanced Opportunities Partnership (EOP). Olga Stefanischina betonte, dass die Ukraine alles in ihrer Macht Stehende tut, um ihren Status im EOP maximal zu nutzen: Kürzlich hat der Präsident der Ukraine dem NATO-Generalsekretär in einem Brief einen entsprechenden Fahrplan vorgestellt.“

Während die Ukraine Scharfmacherei betreibt und die USA und die Nato in ihren Bürgerkrieg hineinziehen möchte, bricht sie auf der anderen Seite weiterhin konsequent auch die letzten Gesprächsfäden nach Moskau ab. In Kiew wurde gerade mal wieder gefordert, „jegliche Interaktion“ mit Russland zu beenden, dazu gehört auch der Abbruch der diplomatischen Beziehungen.

Der merkwürdige ukrainische Nationalismus

Die Politik in Kiew wird seit dem Maidan von radikalen Nationalisten bestimmt, Poroschenko war einer ihrer Wortführer. Wer nach dem Amtsantritt von Selensky auf eine Änderung des Kurses gehofft hat, ist inzwischen desillusioniert. Selenskys Töne unterscheiden sich in nichts mehr von denen Poroschenkos. Dass in der Ukraine Regierungstruppen unter Hakenkreuzfahnen und mit SS-Symbolen an ihren Uniformen kämpfen, ist nur den Konsumenten der Mainstream-Medien unbekannt. Die Mainstream-Medien reden stattdessen immer noch von einer „Demokratie“, die der Maidan dem Land gebracht hätte.

Dass der Nationalismus in der Ukraine politisch genutzt wird, um die radikalisierten Massen zu lenken, ist offensichtlich. Allerdings ist das ein teilweise sehr seltsamer Nationalismus, denn während Poroschenko, Selensky und die Nationalisten stolz von der „unabhängigen Ukraine“ fabulieren, ist das Land längst zu einer Kolonie der USA verkommen, in der ohne ein Okay aus Washington gar nichts mehr geht.

Das treibt teilweise geradezu skurrile Blüten. Während ein neues Sprachengesetz die Sprachen der nationalen Minderheiten im Land (Russisch, Ungarisch, Polnisch und Rumänisch) verbietet, schlägt der ukrainische Sicherheitsrat gleichzeitig vor, Englisch zur zweiten Amtssprache in der Ukraine zu machen.

Man kann die Menschen in dem Land, das nach dem Maidan zum Armenhaus Europas verkommen ist und von kriegslüsternen Politikern geführt wird, die bereit sind, ihr Land und seine Söhne für die Interessen der USA im wahrsten Sinne des Wortes zu opfern, nur noch bedauern.

Und die Menschen im Westen erfahren in ihren „Qualitätsmedien“ von all dem nichts. Für sie wird die in den nächsten Monaten anstehende Verschärfung des Konfliktes völlig überraschend kommen.

Wenn Sie sich für die Ukraine nach dem Maidan und für die Ereignisse des Jahres 2014 interessieren, als der Maidan stattfand, als die Krim zu Russland wechselte und als der Bürgerkrieg losgetreten wurde, sollten Sie sich die Beschreibung zu meinem Buch einmal ansehen, in dem ich diese Ereignisse detailliert auf ca. 670 Seiten genau beschreibe. In diesen Ereignissen liegt der Grund, warum wir heute wieder von einem neuen Kalten Krieg sprechen. Obwohl es um das Jahr 2014 geht, sind diese Ereignisse als Grund für die heutige politische Situation also hochaktuell, denn wer die heutige Situation verstehen will, muss ihre Ursachen kennen.

In meinem neuen Buch „„Putins Plan – Mit Europa und den USA endet die Welt nicht – Wie das westliche System gerade selbst zerstört ““ gehe ich der der Frage, worum es in dem Endkampf der Systeme - den wir gerade erleben - wirklich geht. Wir erleben nichts weniger als den Kampf zweier Systeme, in dem Vladimir Putin der Welt eine Alternative zum neoliberalen Globalismus anbietet. Wurden die Bürger im Westen gefragt, ob sie all das wollen, ob sie zu Gunsten des neoliberalen Globalismus auf ihren Wohlstand und ihre Freiheiten verzichten wollen?

Das Buch ist aktuell erschienen und ausschließlich hier direkt über den J.K. Fischer Verlag bestellbar.



Teile diesen Beitrag teilen

teilen

mitteilen

E-Mail

teilen",https://www.anti-spiegel.ru/2021/ukraine-update-ausbau-der-diktatur-und-vorbereitung-eines-grossen-krieges-im-donbass/,Ukraine is conducting an aggressive policy
42,EU verlängert erneut Sanktionen gegen Russland,"https://snanews.de/20211217/eu-verlaengert-sanktionen-gegen-russland-4717699.html

EU verlängert erneut Sanktionen gegen Russland

EU verlängert erneut Sanktionen gegen Russland

Die EU-Staats- und Regierungschefs haben auf dem EU-Gipfel in Brüssel einstimmig für die Verlängerung der Sanktionen gegen Russland gestimmt, wie der Präsident... 17.12.2021, SNA

2021-12-17T08:30+0100

2021-12-17T08:30+0100

2021-12-17T08:30+0100

russland

europäische union (eu)

politik

sanktionen

verlängerung

gipfeltreffen

/html/head/meta[@name='og:title']/@content /html/head/meta[@name='og:description']/@content

https://cdnn1.snanews.de/img/07e5/0a/16/4054128_0:141:3143:1908_1920x0_80_0_0_c0460a2b4d36fedc28ba765ad8db22ad.jpg

„Die Staats- und Regierungschefs des Europäischen Rates haben einstimmig beschlossen, die Wirtschaftssanktionen gegen Russland zu verlängern“, so Michel via Twitter. Sollte Russland weitere militärische Maßnahmen gegen die Ukraine ergreifen, werde dies massive Konsequenzen und hohe Kosten nach sich ziehen, hieß es weiter.EU-Sanktionen gegen RusslandAls Reaktion verhängte Russland im August 2014 ein Embargo für die Einfuhr von Fleisch-, Fisch- und Milchprodukten sowie von Obst und Gemüse aus den EU-Ländern und den USA. Der Kurs auf Importsubstitution aus der EU trug zum Ausbau von Produktionskapazitäten der entsprechenden Industrien in Russland maßgeblich bei, wodurch auch die Abhängigkeit des Landes von den Ausfuhren verringert wurde. Die Vorteile dieser Politik bewährten sich während der Coronavirus-Pandemie, als die Grenzen geschlossen wurden und der internationale Handel zum Erliegen kam.Die EU-Wirtschaftssanktionen, die seit Juli 2014 alle sechs Monate verlängert werden, richten sich gegen den Finanz-, Energie- und Verteidigungssektor Russlands. Insbesondere wird für einige russische Banken und Unternehmen der Zugang zu den primären und sekundären Kapitalmärkten der EU eingeschränkt und die Ein- und Ausfuhr von Waffen und Gütern mit doppeltem Verwendungszweck verboten. Auch der Zugriff auf eine Reihe von EU-Technologien und Dienstleistungen für Ölförderung und –exploration wird für Russland eingeschränkt.Bedingungen für Aufhebung von SanktionenDie Verlängerung der Sanktionen ist an die vollständige Umsetzung der Minsker Vereinbarungen (Minsk-I) geknüpft. Diese sehen einen Waffenstillstand und den Abzug der Waffen aus dem Donbass vor sowie eine tiefgreifende Verfassungsreform in der Ukraine, die zu einer Dezentralisierung der Macht führen sollte, wobei der Sonderstatus bestimmter Gebiete in den Regionen Donezk und Luhansk zu wahren ist.Das im Februar 2015 unterzeichnete Maßnahmenpaket zur Umsetzung der Minsker Vereinbarungen (Minsk-II) ist bisher nicht umgesetzt worden. Russland bekundete wiederholt sein Engagement für die Vereinbarungen von 2015, die Moskau als alternativlosen Rahmen für die Lösung des internen Konflikts in der Ukraine betrachtet. Kiew weigert sich hingegen, den politischen Teil des Abkommens umzusetzen.Ukraine gegen Minsker AbkommenDer ukrainische Präsident Wladimir Selenski besteht auf der Revision der Minsker Vereinbarungen, was er mehrfach erläuterte. Selenski bezeichnete diese als überholt und betonte, dass ein direkter Dialog zwischen Kiew und den selbsternannten Donezker und Lugansker Republiken (DNR und LNR) unmöglich sei.In letzter Zeit häufen sich zudem die Verstöße gegen die Waffenstillstandsvereinbarung im Donbass seitens der Ukraine. Laut dem aktuellen Tagesbericht vom Dienstag verzeichnete die OSZE-Sonderbeobachtungsmission in der Ukraine (SMM) in den vergangenen 24 Stunden 253 Verletzungen der Waffenruhe in den Regionen Donezk und Luhansk, darunter 29 Explosionen.Die ukrainische Armee zieht Panzer und andere militärische Ausrüstung aus den Zufahrten zur DNR ab, während mehrere westliche Staaten Waffenlieferungen für Kiew zustimmten und Kämpfer unter Deckmantel von Ausbildern in die Ukraine entsendeten.

https://snanews.de/20211207/ex-nato-chef-usa-wissen-von-konkreten-plaenen-russlands-4597677.html

https://snanews.de/20211210/angespannte-geopolitische-situation-4604791.html

https://snanews.de/20211215/britischer-premier-moskau-ukraine-4700086.html

russland

SNA info@snanews.de +493075010627 MIA „Rosiya Segodnya“ 157 60

2021

SNA info@snanews.de +493075010627 MIA „Rosiya Segodnya“ 157 60

Nachrichten

de_DE

SNA info@snanews.de +493075010627 MIA „Rosiya Segodnya“ 157 60

1920 1080 true

1920 1440 true

1920 1920 true

SNA info@snanews.de +493075010627 MIA „Rosiya Segodnya“ 157 60

SNA

eu russland sanktionen, eu verlängert sanktionen, ukraine sanktionen eu, wirtschaftssanktionen eu, wirtschaftssanktionen russland, eu-gipfel russland",https://snanews.de/20211217/eu-verlaengert-sanktionen-gegen-russland-4717699.html,Ukraine is conducting an aggressive policy
43,Das russische Fernsehen über die Eskalation in der Ukraine,"Wie jeden Sonntag in diesem Jahr waren auch an diesem Sonntag die Eskalationen in der Ukraine wieder Thema im russisches Wochenrückblich. In Kiew wird inzwischen offen von einem Krieg mit Russland gesprochen.

Natürlich waren die Eskalationen aus Kiew und deren Unterstützung aus den USA am Sonntag wieder Thema im Wochenrückblich des russischen Fernsehens. Neben dem, wovon im russischen Fernsehen die Rede war, sind noch einige andere Dinge in Kiew vorgefallen, über die ich in den nächsten Tagen ein neues Ukraine-Update schreiben werde. Hier beschränke ich mich auf die Übersetzung des Berichtes aus der russischen Sendung „Nachrichten der Woche.“

Die deutschen Medien haben Kiews Schritte zur Eskalation seit Januar verschwiegen. Aber da sie das Thema Ukraine nun auch wieder für sich entdeckt haben und Russland schon jetzt die Schuld für das geben, was demnächst kommen wird, dürfte es für viele interessant sein, wie im russischen Fernsehen darüber berichtet wird.

Beginn der Übersetzung:

Schlechte Nachrichten aus der Ukraine. In Kiew spricht man",https://uncutnews.ch/das-russische-fernsehen-ueber-die-eskalation-in-der-ukraine/,Ukraine is conducting an aggressive policy
44,Krieg im Donbass: Donezker und Lugansker Volksrepubliken melden für 2021 fast einhundert Getötete,"Krieg im Donbass: Donezker und Lugansker Volksrepubliken melden für 2021 fast einhundert Getötete

Im Durchschnitt forderte der schwelende Bürgerkrieg im Donbass im Jahr 2021 fast jeden zweiten Tag einen Toten auf beiden Seiten der Trennlinie. Die Verluststatistik hat sich gegenüber dem Jahr 2020 somit kaum verbessert. In den nicht anerkannten Volksrepubliken werden auch immer noch Zivilisten getötet.

Die im April 2014 selbst ausgerufenen Volksrepubliken Donezk (DVR) und Lugansk (LVR) haben die Zahl ihrer Verluste durch den militärischen Konflikt mit der Zentralregierung in Kiew für das zu Ende gehende Jahr 2021 bekanntgegeben.

So zählt die etwas dichter besiedelte DVR 77 Tote und 129 Verletzte, wobei 7 der Todesopfer Zivilisten und die übrigen Vertreter der Volksmiliz waren.

""Vom 1. Januar bis zum 30. Dezember 2021 wurden 97 Soldaten und 32 Zivilisten verletzt, während im gleichen Zeitraum 70 Soldaten und sieben Zivilisten getötet wurden"", teilte der Pressedienst des Büros des Ombudsmanns der DVR am Donnerstag in einer Erklärung mit.

Analyse Wie der Krieg in der Ukraine verhindert werden kann

Die Volksrepublik Lugansk meldete am Mittwoch 21 Tote – einen Zivilisten und zwanzig Militärangehörige. ""Fast alle Toten und Verwundeten sind das Ergebnis von gezieltem Scharfschützenfeuer ukrainischer bewaffneter Verbände"", sagte der Chef der Lugansker Volksrepublik Leonid Passetschnik.

Zusammengenommen beklagen die DVR und LVR damit 98 Getötete durch Kriegsgeschehen – und das trotz einer offiziell proklamierten Waffenruhe, die seit Juni 2020 gilt.

Schätzungen zufolge zählen die beiden abtrünnigen Gebiete in der Ostukraine bis zu 34.000 reguläre Soldaten. Die Einheiten der von der NATO ausgebildeten ukrainischen Armee, die in der Konfliktregion stationiert sind, zählen nach russischen Angaben bis zu 125.000 Mannstärke. Das ist fast die Hälfte der gesamten regulären ukrainischen Armee. Auch diese Seite meldet Verlustzahlen in gleicher Größenordnung wie ihre zahlenmäßig unterlegenen Gegner.

So verloren nach Angaben des Nachrichtenportals 24.ua im Jahr 2021 insgesamt 76 ukrainische Soldaten ihr Leben. Ihre Namen sowie Datum und Umstände des Todes werden ebenso veröffentlicht. Im Jahr 2020 waren es mindestens 75.

Doch die Ukraine verliert ihre Soldaten nicht nur auf dem Kampffeld. Bemerkenswert ist der hohe Anteil nicht kampfbedingter Todesfälle. Im Jahr 2020 waren es laut 24.ua 79 Tote, wobei die häufigsten Ursachen Unfälle, Selbstmord und Trunksucht waren.

Wie in Kriegszeiten üblich, beschuldigen die beiden Konfliktparteien jeweils den Gegner gezielter Provokationen, die zu Feindseligkeiten führten. Eine OSZE-Statistik, wonach bis zu 80 Prozent der Zerstörungen und der zivilen Kriegsopfer im Territorium der selbstausgerufenen Republiken zu beklagen seien, geben jedoch etwas Aufschluss über die Art und Weise der ukrainischen Kriegsführung.

So zählte die Donezker Volksrepublik allein auf ihrem Territorium in diesem Jahr 1.923 Verstöße gegen das Waffenstillstandregime vonseiten der ""ukrainischen bewaffneten Formationen"". Abgefeuert wurden dabei 4.197 Minen und Granaten mit einem Kaliber von 82, 120, 122 und 152 Millimetern. Auch die Zerstörungen der zivilen Infrastruktur wurden gezählt: 283 Wohnhäuser und 74 Infrastruktureinrichtungen seien durch den Beschuss beschädigt worden, teilte ein Sprecher der Republik mit.

Offiziell werden die Separatisten der Donezker und der Lugansker Volksrepublik innerhalb der Ukraine als ""Okkupanten"" bezeichnet. Die Faktenlage spricht jedoch eher dafür, dass es die Ukraine ist, die sich in diesem innerstaatlichen Konflikt wie ein Aggressor gegenüber den Abtrünnigen verhält.

In den letzten Monaten wurden in den beiden Volksrepubliken mehrere Massengräber geöffnet und bis zu 300 Kriegsopfer mittels der genetischen Datenbanken identifiziert und umgebettet. Sie wurden infolge des Beschusses mit Minen und Granaten sowie durch Handfeuerwaffen getötet. Eine RT-Dokumentation in russischer Sprache zeigt ausführlich, wie diese Arbeiten vonstattengehen. Es werde gegen die Ukraine daher wegen Kriegsverbrechen ermittelt.

Die Menschenrechtsbeauftragte der Volksrepublik Donezk Darja Morosowa schätzt die Zahl der im Bürgerkrieg seit 2014 getöteten Zivilisten auf 9.000 Menschen, wobei sie teils auch Angehörige der Volksmiliz zu den Zivilisten zählte. Die offiziellen Schätzungen der UNO zur Anzahl der Opfer des Bürgerkrieges liegen bei 13.000, darunter 5.000 Zivilisten.

Mehr zum Thema - Volksrepubliken Donezk und Lugansk anerkennen – und so die Ukraine zum Frieden zwingen",https://de.rt.com/europa/129217-krieg-im-donbass-donezker-und-lugansker-volksrepubliken-melden-fast-hundert-tote-jahr-2021/,Ukraine is conducting an aggressive policy
